<?xml version="1.0" encoding="UTF-8" standalone="no"?><md:Library xmlns:md="http://www.example.org/sipvs" xmlns:xsi="http://www.w3.org/2001/XMLSchema-instance" xsi:schemaLocation="http://www.example.org/sipvs/schema.xsd"><md:Book><md:BookName>name</md:BookName><md:AuthorName>author @_ AS &gt;&lt;$%#^&amp;</md:AuthorName><md:Pages>54</md:Pages><md:PrintingYear>1999</md:PrintingYear><md:FirstPublished>655</md:FirstPublished><md:ISBN>a156152</md:ISBN><md:BookDescription>description @#^$W 1385 }| ?</md:BookDescription><md:BorrowHistory><md:Borrow id="1"><md:StudentName>marek</md:StudentName><md:BorrowDate>2020-10-07</md:BorrowDate><md:ReturnDate>2020-10-08</md:ReturnDate></md:Borrow><md:Borrow id="2"><md:StudentName>marek1</md:StudentName><md:BorrowDate>2020-10-07</md:BorrowDate><md:ReturnDate>2020-10-08</md:ReturnDate></md:Borrow></md:BorrowHistory></md:Book></md:Library>